{
  "$schema": "https://json-schema.org/draft/2020-12/schema",
  "title": "Discipline",
  "type": "object",
  "required": ["id", "name", "rosterSize", "statWeights", "contest", "economy"],
  "additionalProperties": false,
  "properties": {
    "id": {
      "type": "string",
      "pattern": "^[a-z0-9-]+$"
    },
    "name": {
      "type": "string",
      "description": "English discipline name, shown to the player (docs/adr/0007)"
    },
    "rosterSize": {
      "type": "integer",
      "minimum": 1,
      "maximum": 6
    },
    "statWeights": {
      "type": "object",
      "additionalProperties": false,
      "required": ["mechanical", "cognitive", "collective", "composure"],
      "properties": {
        "mechanical": {
          "type": "number"
        },
        "cognitive": {
          "type": "number"
        },
        "collective": {
          "type": "number"
        },
        "composure": {
          "type": "number"
        }
      }
    },
    "metaVolatility": {
      "type": "number",
      "minimum": 0,
      "maximum": 1,
      "description": "how often and how strongly patches shift the weights"
    },
    "contest": {
      "type": "object",
      "required": ["format", "momentumMeans", "tally", "columns"],
      "additionalProperties": false,
      "properties": {
        "format": {
          "enum": ["bo1", "bo3", "bo5", "points-table"]
        },
        "unit": {
          "enum": ["round", "phase", "map", "half"]
        },
        "momentumMeans": {
          "type": "string",
          "description": "what the bar means in this discipline; the text is English, shown to the player (docs/adr/0007)"
        },
        "tally": {
          "enum": ["rounds", "objectives", "placement-points", "goals"]
        },
        "columns": {
          "type": "array",
          "description": "player table column headers, in English (docs/adr/0007)",
          "minItems": 2,
          "items": {
            "type": "string"
          }
        },
        "participants": {
          "type": "integer",
          "minimum": 2,
          "default": 2
        }
      }
    },
    "economy": {
      "type": "object",
      "required": ["baseWeeklyRate", "salaryScale"],
      "additionalProperties": false,
      "properties": {
        "baseWeeklyRate": {
          "type": "number",
          "exclusiveMinimum": 0
        },
        "prizeScale": {
          "type": "number"
        },
        "viewerScale": {
          "type": "number"
        },
        "salaryScale": {
          "type": "number",
          "exclusiveMinimum": 0
        }
      }
    },
    "strongRegions": {
      "type": "array",
      "items": {
        "type": "string"
      }
    }
  }
}
